<?xml version="1.0" encoding="UTF-8"?>

<xs:schema xmlns:xs="http://www.w3.org/2001/XMLSchema">

<xs:element name="baseDeDatos">
    <xs:complexType>
        <xs:sequence>

            <xs:element name="usuario" maxOccurs="unbounded">
                <xs:complexType>
                    <xs:sequence>

                        <xs:element name="nombreUsuario">
                            <xs:simpleType>
                                <xs:restriction base="xs:string">
                                    <xs:pattern value="[a-zA-Z0-9]{4,12}"/>
                                </xs:restriction>
                            </xs:simpleType>
                        </xs:element>

                        <xs:element name="email">
                            <xs:simpleType>
                                <xs:restriction base="xs:string">
                                    <xs:pattern value="[a-zA-Z0-9._%+-]+@[a-zA-Z]+\.[a-z]{2,}"/>
                                </xs:restriction>
                            </xs:simpleType>
                        </xs:element>

                        <xs:element name="telefono">
                            <xs:simpleType>
                                <xs:restriction base="xs:string">
                                    <xs:pattern value="[0-9]{9}"/>
                                </xs:restriction>
                            </xs:simpleType>
                        </xs:element>

                        <xs:element name="codigoPostal">
                            <xs:simpleType>
                                <xs:restriction base="xs:string">
                                    <xs:pattern value="[0-9]{5}"/>
                                </xs:restriction>
                            </xs:simpleType>
                        </xs:element>

                        <xs:element name="contrasena">
                            <xs:simpleType>
                                <xs:restriction base="xs:string">
                                    <xs:pattern value="[a-zA-Z0-9]{6,12}"/>
                                </xs:restriction>
                            </xs:simpleType>
                        </xs:element>

                    </xs:sequence>
                </xs:complexType>
            </xs:element>

        </xs:sequence>
    </xs:complexType>
</xs:element>

</xs:schema>